Publication Title,Summary,Published By,Publication Year,Technology Area,Publication Type,CMS node
EVs at Scale 2022 Bi-Annual Stakeholder Meeting presentation ,"Electric Vehicles at Scale (EVs at Scale) consortium Bi-Annual Stakeholder Meeting Presentation given August 17, 2022. The EVs at Scale Consortium brings together national laboratories and key stakeholders to conduct infrastructure research and development to address challenges and barriers for high-power EV charging infrastructure that enable greater safety, grid operation reliability, and consumer confidence.",National Renewable Energy Laboratory,2022,EVs@Scale,Presentation,https://www.nrel.gov/docs/fy22osti/83838.pdf
2021 Advanced Engine and Fuel Technologies Annual Progress Report,"The Advanced Engine and Fuel Technologies Program supports the Vehicle Technologies Office’s goals of transportation decarbonization, increasing domestic energy security through fuel diversification, improving internal combustion engine efficiency, reducing greenhouse gas and air pollutant emissions, and reducing vehicle initial and operating costs for consumers and businesses. The Program focuses on early-stage research and development (R&D) to improve understanding of the combustion processes, fuel properties, emissions
control technologies, and their interrelationships while generating knowledge and insight necessary for the on
and off-road vehicle industries to develop the next generation of internal combustion engines. ",Vehicle Technologies Office,2022,Advanced Engine and Fuel Technoloies,Report,http://www.energy.gov/node/4823218
2021 Energy Efficient Mobility Systems Annual Progress Report,"DOE conducts research to understand how the changing mobility landscape will affect transportation energy consumption and identifies opportunities to create more efficient, affordable, reliable, accessible, equitable, and secure transportation options that enhance mobility for individuals and businesses. Within EERE, the EEMS Program is responsible for this research portfolio. This APR describes work that the EEMS Program conducted during FY 2021 in support of the EEMS Program goals.",Vehicle Technologies Office,2022,Energy Efficient Mobility Systems,Report,http://www.energy.gov/node/4823279
2021 Electrification Annual Progress Report,"The Electric Drive Technologies (EDT) program’s mission is to conduct early-stage research and development on transportation electrification technologies that accelerate the development of cost-effective and compact electric traction drive systems that meet or exceed performance and reliability requirements of internal combustion engine (ICE)-based vehicles, thereby enabling electrification across all light-duty vehicle types. The Grid and Charging Infrastructure (G&I) program's mission is to conduct early-stage research and development on transportation electrification technologies that enable reduced petroleum consumption by light, medium, and heavy-duty vehicles. The program identifies and enables the role of vehicles in the future electrical grid.",Vehicle Technologies Office,2022,Batteries and Electrification,Report,http://www.energy.gov/node/4823224
2021 Materials Annual Progress Report,"The Materials Technology subprogram supports the VTO’s mission to accelerate the deployment of clean energy technology toward achieving net-zero emissions in the transportation sector. Lighter vehicles with more efficient powertrains reduce energy use, decrease greenhouse gas (GHG) emissions, and save consumers money.",Vehicle Technologies Office,2022,Materials,Report,https://www1.eere.energy.gov/vehiclesandfuels/downloads/VTO_2021_Materials_Consolidated_Report_FINAL_2022-09-14_compliant_v2.pdf
2021 Technology Integration Annual Progress Report,"VTO's Technology Integration Program supports a broad technology portfolio that includes alternative fuels, energy efficient mobility systems and technologies, and other efficient advanced technologies that can reduce transportation energy costs for businesses and consumers. The program provides objective, unbiased data and real-world lessons learned to inform future research needs and support local decision making. It also includes projects to disseminate data, information, and insight, as well as online tools and technology assistance to cities and regions working to implement alternative fuels and energy efficient mobility technologies and systems.",Vehicle Technologies Office,2022,Technology Integration,Report,http://www.energy.gov/node/4823278
2021 Batteries Annual Progress Report,"During the fiscal year 2021 (FY 2021), the Vehicle Technologies Office’s (VTO) Batteries program continued research and development (R&D) support of battery technologies for plug-in electric vehicles (PEVs), e.g., plug-in hybrids, extended range electric vehicles, all-electric vehicles, and some hybrid electric vehicles. One objective of this support is to enable U.S. innovators to rapidly develop next generation of technologies that achieve the cost, range, and charging infrastructure necessary for the widespread adoption of PEVs.",Vehicle Technologies Office,2022,Batteries and Electrification,Report,https://www1.eere.energy.gov/vehiclesandfuels/downloads/VTO_2021_APR_BATTERIES_v8_compliant.pdf
2021 Analysis Annual Progress Report,"The VTO Analysis Program supports mission-critical technological, economic, and interdisciplinary analyses to assist in prioritizing VTO technology investments and to inform research portfolio planning. These efforts provide essential vehicle and market data, modeling and simulation, and integrated and applied analyses, using the unique capabilities, analytical tools, and expertise resident in the DOE’s national laboratory system.",Vehicle Technologies Office,2022,Analysis,Report,http://www.energy.gov/node/4823222
2021 Annual Merit Review Report,"The 2021 U.S. Department of Energy (DOE), Office of Energy Efficiency and Renewable Energy’s (EERE) Vehicle Technologies Office (VTO) Annual Merit Review (AMR) was held June 21-25, 2021, virtually, due to extenuating circumstances resulting from the global coronavirus disease (COVID-19) pandemic. The review encompassed work done by VTO:  273 individual activities were reviewed by 281 reviewers. Exactly 1,152 individual review responses were received for the VTO technical reviews. The objective of the meeting was to review the accomplishments and plans for VTO over the previous 12 months, and provide an opportunity for industry, government, and academia to give inputs to DOE with a structured and formal methodology. The meeting also provided attendees with a virtual forum for interaction and technology information transfer.",Vehicle Technologies Office,2021,Office-wide,Report,http://www.energy.gov/node/4815723
U.S. DRIVE Highlights of Technical Accomplishments 2021,The U.S. DRIVE 2021 Highlights of Technical Accomplishments Report summarizes key technical accomplishments in the development of advanced automotive and related energy infrastructure technologies achieved in 2021 by the U.S. DRIVE partnership.,U.S. DRIVE Partnership,2022,Office-wide,Report,http://www.enegy.gov/node/4819774
Transportation Energy Data Book (TEDB) Edition 40,"The Transportation Energy Data Book: Edition 40 is a statistical compendium prepared and published by Oak Ridge National Laboratory (ORNL) under contract with the U.S. Department of Energy, Office of Energy Efficiency and Renewable Energy, Vehicle Technologies Office. Designed for use as a desk-top reference, the Data Book represents an assembly and display of statistics and information that characterize transportation activity and presents data on other factors that influence transportation energy use. The purpose of this document is to present relevant statistical data in the form of tables and graphs. The latest edition of the Data Book is available via the Internet (tedb.ornl.gov).",Oak Ridge National Laboratory,2022,Analysis,Report,https://tedb.ornl.gov/wp-content/uploads/2022/03/TEDB_Ed_40.pdf
Net-Zero Carbon Fuels Technical Team Analysis Summary Report,"The Net-Zero Carbon Fuels Technical Team (NZTT) is tasked with investigating the potential to generate carbon-based fuels with much lower carbon intensities (CIs) compared to those of conventional fuels, approaching or exceeding net-zero greenhouse gas (GHG)
emissions. In this study, the life cycle GHG emissions of four fuel production pathways and dozens of variants on those pathways are analyzed. Additionally, the overall cost of each pathway is evaluated and calculated as minimum fuel selling price (MFSP).",U.S. DRIVE Partnership,2021,Office-wide,Report,http://www.energy.gov/node/4815543
Shared Automated Vehicle Fleet Operations for First-Mile Last-Mile Transit Connections with Dynamic Pooling,"Shared Automated Vehicles (SAVs) have the potential to promote transit ridership by providing efficient first-mile last-mile (FMLM) connections through reduced operational costs to fleet providers and lower out-of-pocket costs to riders. To help plan for a future of integrated mobility, this paper investigates the impacts of SAVs serving FMLM connections, as a mode that provides flexibility in access/egress decisions and is well coordinated with train station schedules. To achieve this objective, a novel dynamic pooling algorithm was introduced to match SAVs with riders while coordinating the riders' arrival times at the light-rail station to a known train schedule. Microsimulations of SAVs and travelers throughout two central Austin neighborhoods show how larger service areas, higher levels of SAV demand, and longer arrival times between successive trains require larger SAV fleet sizes and higher SAV utilization rates to deliver close traveler wait times. Four-person SAVs appear to perform similar to 6-seat SAVs but will cost less to provide. Using a dynamic pooling algorithm tightly coordinated with train arrivals (every 15 min) delivers 87% of travelers to their stations in time to catch the next train, while uncoordinated assignments deliver just 58% of travelers in time. ",National Renewable Energy Laboratory,2021,Energy Efficient Mobility Systems,Journal Publication,https://www.researchgate.net/publication/347017497_Use_of_Shared_Automated_Vehicles_for_First-Mile_Last-Mile_Service_Micro-Simulation_of_Rail-Transit_Connections_in_Austin_Texas
Model Year 2022 Fuel Economy Guide,"The Fuel Economy Guide is published by the U.S. Department of Energy as an aid to consumers considering the purchase of a new vehicle. The Guide lists estimates of miles per gallon (mpg) for each vehicle available for the new model year. These estimates are provided by the U.S. Environmental Protection Agency in compliance with Federal Law. By using this Guide, consumers can estimate the average yearly fuel cost for any vehicle. The Guide is intended to help consumers compare the fuel economy of similarly sized cars, light duty trucks and special purpose vehicles.",Vehicle Technologies Office,2021,Technology Integration,Report,https://www.fueleconomy.gov/feg/pdfs/guides/FEG2022.pdf
Transportation Energy Data Book (TEDB) Edition 38,"The Transportation Energy Data Book: Edition 38 is a statistical compendium prepared and published by Oak Ridge National Laboratory (ORNL) under contract with the U.S. Department of Energy, Office of Energy Efficiency and Renewable Energy, Vehicle Technologies Office. Designed for use as a desk-top reference, the Data Book represents an assembly and display of statistics and information that characterize transportation activity, and presents data on other factors that influence transportation energy use. The purpose of this document is to present relevant statistical data in the form of tables and graphs. The latest edition of the Data Book is available via the Internet (tedb.ornl.gov).",Oak Ridge National Laboratory,2020,Analysis,Report,https://info.ornl.gov/sites/publications/Files/Pub132663.pdf
Model Year 2021 Fuel Economy Guide ,"The Fuel Economy Guide is published by the U.S. Department of Energy as an aid to consumers considering the purchase of a new vehicle. The Guide lists estimates of miles per gallon (mpg) for each vehicle available for the new model year. These estimates are provided by the U.S. Environmental Protection Agency in compliance with Federal Law. By using this Guide, consumers can estimate the average yearly fuel cost for any vehicle. The Guide is intended to help consumers compare the fuel economy of similarly sized cars, light duty trucks and special purpose vehicles.",Vehicle Technologies Office,2021,Technology Integration,Report,https://www.fueleconomy.gov/feg/pdfs/guides/FEG2021.pdf
Model Year 2020 Fuel Economy Guide ,"The Fuel Economy Guide is published by the U.S. Department of Energy as an aid to consumers considering the purchase of a new vehicle. The Guide lists estimates of miles per gallon (mpg) for each vehicle available for the new model year. These estimates are provided by the U.S. Environmental Protection Agency in compliance with Federal Law. By using this Guide, consumers can estimate the average yearly fuel cost for any vehicle. The Guide is intended to help consumers compare the fuel economy of similarly sized cars, light duty trucks and special purpose vehicles.",Vehicle Technologies Office,2020,Technology Integration,Report,https://fueleconomy.gov/feg/pdfs/guides/FEG2020.pdf
Model Year 2019 Fuel Economy Guide,"The Fuel Economy Guide is published by the U.S. Department of Energy as an aid to consumers considering the purchase of a new vehicle. The Guide lists estimates of miles per gallon (mpg) for each vehicle available for the new model year. These estimates are provided by the U.S. Environmental Protection Agency in compliance with Federal Law. By using this Guide, consumers can estimate the average yearly fuel cost for any vehicle. The Guide is intended to help consumers compare the fuel economy of similarly sized cars, light duty trucks and special purpose vehicles.",Vehicle Technologies Office,2019,Technology Integration,Report,https://fueleconomy.gov/feg/pdfs/guides/FEG2019.pdf
2020 Advanced Engine and Fuel Technologies Annual Progress Report,"The Advanced Engine and Fuel Technologies Program supports the Vehicle Technologies Office's goal of increasing domestic energy security through fuel diversification, improving internal combustion (IC) engine efficiency and emissions, and reducing vehicle initial and operating costs for consumers and businesses. The Program focuses on early-stage research and development (R&D) to improve understanding of the combustion processes, fuel properties, emissions control technologies, and their interrelationships while generating knowledge and insight necessary for industry to develop the next generation of IC engines.",Vehicle Technologies Office,2021,Advanced Engine and Fuel Technoloies,Report,http://www.energy.gov/node/4811371
2020 Energy Efficient Mobility Systems Annual Progress Report,"The U.S. Department of Energy (DOE) Office of Energy Efficiency and Renewable Energy (EERE) Vehicle Technologies Office (VTO) created the Energy Efficient Mobility Systems (EEMS) Program to understand the range of mobility futures that could result from disruptive transportation technologies and services and to create solutions that improve mobility energy productivity (MEP), or energy efficiency, affordability, and access provided by the transportation system. Increases in MEP result from improvements in the quality or output of the transportation system and/or reductions in the energy and cost of transportation. EEMS Program activities during FY 2020 focused on analytical research and large-scale modeling and simulation to understand the impacts that new mobility technologies and services will have at the vehicle-, traveler-, and overall transportation system-level.",Vehicle Technologies Office,2021,Energy Efficient Mobility Systems,Report,http://www.energy.gov/node/4811369
2020 Electrification Annual Progress Report,"The VTO Electrification Sub-Program is composed of Electric Drive Technologies, and Grid Integration activities. The Electric Drive Technologies (EDT) program's mission is to conduct early-stage research and development on transportation electrification technologies that accelerate the development of cost-effective and compact electric traction drive systems that meet or exceed performance and reliability requirements of internal combustion engine (ICE)-based vehicles, thereby enabling electrification across all light-duty vehicle types. The Grid and Charging Infrastructure (G&I) program's mission is to conduct early-stage research and development on transportation electrification technologies that enable reduced petroleum consumption by light, medium, and heavy-duty vehicles. This document presents a brief overview of the Electrification Sub-Program and progress reports for its R&D projects. Each of the progress reports provide a project overview and highlights of the technical results that were accomplished in FY 2020.",Vehicle Technologies Office,2021,Batteries and Electrification,Report,https://www1.eere.energy.gov/vehiclesandfuels/downloads/VTO_2020_APR_ELECTRIFICATION_COMPILED_REPORT_July%2014%20compliant_.pdf
2020 Materials Annual Progress Report,"The Materials Technology Program supports the Vehicle Technologies Office's (VTO's) mission to help consumers and businesses reduce their transportation energy costs while meeting or exceeding vehicle performance expectations. The propulsion materials research portfolio seeks to develop higher performance materials that can withstand increasingly extreme environments and address the future properties needed for a variety of high-efficiency powertrain types, sizes, fueling concepts, and combustion modes. The lightweight materials research portfolio enables improvements in fuel economy by providing properties that are equal to or better than traditional materials at a lower weight. Because it takes less energy to accelerate a lighter object, replacing cast-iron and traditional steel components with lightweight materials such as advanced high-strength steels, magnesium (Mg) alloys, aluminum (Al) alloys, and fiber-reinforced polymer composites can directly reduce a vehicle's fuel consumption. By 2025, Materials Technology research activities seek to enable a 25% weight reduction of the glider for light-duty (LD) vehicles including body, chassis, and interior as compared to a 2015 baseline at no more than a $5/lb-saved increase in cost.
",Vehicle Technologies Office,2021,Materials,Report,https://www1.eere.energy.gov/vehiclesandfuels/downloads/FY-2020%20Materials%20Consolidated%20Report_final_compliant_2021-06-15_.pdf
2020 Technology Integration Annual Progress Report,"VTO's Technology Integration Program supports a broad technology portfolio that includes alternative fuels, energy efficient mobility systems and technologies, and other efficient advanced technologies that can reduce transportation energy costs for businesses and consumers. The program provides objective, unbiased data and real-world lessons learned to inform future research needs and support local decision making. It also includes projects to disseminate data, information, and insight, as well as online tools and technology assistance to cities and regions working to implement alternative fuels and energy efficient mobility technologies and systems.",Vehicle Technologies Office,2021,Technology Integration,Report,http://www.energy.gov/node/4811367
2020 Batteries Annual Progress Report,"During the fiscal year 2020 (FY 2020), the Vehicle Technologies Office (VTO) battery program continued research and development (R&D) support of technologies for plug-in electric vehicles (PEVs), e.g., plug-in hybrids, extended range electric vehicles, all-electric vehicles, and some hybrid electric vehicles (including 12 volt start/stop hybrid). One objective of this support is to enable U.S. innovators to rapidly develop next generation of technologies that achieve the cost, range, and charging infrastructure necessary for the widespread adoption of PEVs.",Vehicle Technologies Office,2021,Batteries and Electrification,Report,https://www1.eere.energy.gov/vehiclesandfuels/downloads/VTO_2020_APR_Batteries_compliant_.pdf
2020 Analysis Annual Progress Report,"The VTO Analysis Program supports mission-critical technology, economic, and interdisciplinary analyses to assist in prioritizing VTO technology investments and to inform research portfolio planning. These efforts provide essential vehicle and market data, modeling and simulation, and integrated and applied analyses, using the unique capabilities, analytical tools, and expertise resident in the national laboratory system.",Vehicle Technologies Office,2021,Analysis,Report,http://energy.gov/node/4811366/
Hybrid Neural Network Modeling for Multiple Intersections along Signalized Arterials - Current Situation and Some New Results ,"Traffic flow along signalized arterials is a dynamic, nonlinear, and stochastic system in which the relationship between the signal timing plan and traffic delays is too complicated to be modeled using first principles approaches. With advances in sensing technologies, various data sets are available, allowing effective data-driven modeling to be conducted for further controller design. In this keynote paper, a Hybrid Neural Network (HNN) is proposed to model the multiple intersections along a signalized arterial in Honolulu, in which both modeling structure and the relevant training algorithms have been developed. HNN modeling using real data has shown a set of promising results, with dynamic model performance assessed using model error Probability Density Function (PDF). A simple HNN model can easily be used as a starting point for an artificial intelligence-based closed-loop control design that controls the signal timing to reduce the traffic delay. ",Oak Ridge National Laboratory,2021,Energy Efficient Mobility Systems,Conference Paper,http://energy.gov/node/4811501
U.S. DRIVE Highlights of Technical Accomplishments 2020,The U.S. DRIVE 2020 Highlights of Technical Accomplishments Report summarizes key technical accomplishments in the development of advanced automotive and related energy infrastructure technologies achieved in 2020 by the U.S. DRIVE partnership.,U.S. DRIVE Partnership,2021,Office-wide,Report,http://www.energy.gov/node/4809292
A Real-Time Intelligent Speed Optimization Planner Using Reinforcement Learning,"In this paper, we combined a conventional speed optimization planner, developed in our previous work, and reinforcement learning to propose a real-time intelligent speed optimization planner for connected and automated vehicles. We used a deep reinforcement learning algorithm to find the policy of how to adjust key parameters in real-time to dynamically changing situations in order to realize the full potential of energy-efficient driving. Results showed the learned optimal policy enables the proposed intelligent speed optimization planner to properly adjust the parameters in a piecewise constant manner, leading to additional energy savings without increasing total travel time compared to the conventional speed optimization planner.",Argonne National Laboratory,2021,Energy Efficient Mobility Systems,Conference Paper,http://www.energy.gov/media/246062
A Data-Driven Approach to Characterize the Impact of Connected and Autonomous Vehicles on Traffic Flow,"This study presents a model to characterize changes in network traffic flows as a result of implementing connected and autonomous vehicle (CAV) technology based on traffic network and built-environment characteristics. To develop such a model, first, the POLARIS agent-based modeling platform is used to predict changes in average daily traffic (ADT) under CAV scenario in the road network of Chicago metropolitan area as the dependent variable of the model. Second, a comprehensive set of variables and indicators representing network characteristics and urban structure patterns are generated. Finally, three machine learning techniques, namely, K-Nearest neighbors, Random Forest, and eXtreme Gradient Boosting, are used to characterize changes in ADT based on network characteristics under a CAV scenario. The estimated models are validated and are found to yield acceptable performance. In addition, SHapley Additive exPlanations (SHAP) analysis tool is employed to investigate the impact of important features on changes in ADT.",Argonne National Laboratory,2020,Energy Efficient Mobility Systems,Journal Publication,https://www.tandfonline.com/doi/full/10.1080/19427867.2020.1776956
