Publication Title,Summary,Published By,Publication Year,Technology Area,Publication Type,CMS node
Sizing Dynamic Wireless Charging for Light-Duty Electric Vehicles in Roadway Applications,"Dynamic wireless charging is a possible cure for the range limitations seen in electric vehicles (EVs) once implemented in highways or city streets. The contribution of this paper is the use of experimental data to show that the expected energy gain from a dynamic wireless power transfer (WPT) system is largely a function of average speed, which allows the power level and number of coils per mile of a dynamic WPT system to be sized for the sustained operation of an EV.",Oak Ridge National Laboratory,2018,Energy Efficient Mobility Systems,Conference Paper,http://www.energy.gov/node/4045620
Grid Impact Studies from Dynamic Wireless Charging in Smart Automated Highways,"Autonomous and electrified mobility are two key developments expected in the next decade to improve the efficiency and reduce carbon footprint of transportation. As electric vehicles (EVs) increase on the roads, one of the issues that needs to be addressed is range anxiety. To mitigate this problem and for seamless integration of EVs, dynamic wireless charging is an attractive solution. In this paper, a few case studies are considered in a smart autonomous highway to understand the impact of dynamic wireless charging on grid dynamics.",Oak Ridge National Laboratory,2018,Energy Efficient Mobility Systems,Conference Paper,http://www.energy.gov/node/4045617
21st Century Truck Partnership Research Blueprint,"The 21st Century Truck Partnership (21CTP, or the Partnership) is a longstanding government/industry research collaboration with industrial partners across the commercial truck value chain and government partners with civilian and military missions. The Partnership aims to foster technological innovation in improving the energy efficiency and reducing the costs of the nation's economically vital truck freight transportation system through this strategic public-private partnership. Partners are involved as a result of their interests in the overall aims of 21CTP as described above.
This blueprint document is meant as a summary of the Partnership's updated collaborative research efforts to make transportation energy more affordable and secure. The Partnership is developing all-new roadmap documents with additional details to provide the technical foundation for research priorities, and the reader is encouraged to review these resources for more information.",21st Century Truck Partnership,2019,Advanced Engine and Fuel Technoloies,Report,http://www.energy.gov/node/4040103
City-Wide Eco-Routing Navigation Considering Vehicular Communication Impacts,"Intelligent Transportation Systems (ITSs) utilize Vehicular Ad-hoc Networks (VANETs) to collect, disseminate, and share data with the Traffic Management Center (TMC) and different actuators. Consequently, packet drop and delay in VANETs can significantly impact ITS performance. Feedback-based eco-routing (FB-ECO) is a promising ITS technology, which is expected to reduce vehicle fuel/energy consumption and pollutant emissions by routing drivers through the most environmentally friendly routes.",Virginia Tech Transportation Institute,2019,Energy Efficient Mobility Systems,Journal Publication,http://www.energy.gov/node/4038921
A Time-Dependent Intermodal A* Algorithm: Methodology and Implementation on a Large-Scale Network,"This paper proposes a Time-Dependent Intermodal A* (TDIMA*) algorithm. The algorithm works on a multi-modal network with transit, walking, and vehicular network links, and finds paths for the three major modes (transit, walking, driving) and any feasible combination thereof (e.g. park- and-ride). Turn penalties on the vehicular network and progressive transfer penalties on the transit network are considered for improved realism. Moreover, thresholds to prevent excessive waiting and walking are introduced, as well as a threshold on driving for the park-and-ride mode.",Argonne National Laboratory,2018,Energy Efficient Mobility Systems,Conference Paper,http://www.energy.gov/node/4038918
"Quantifying the Mobility and Energy Benefits of Automated Mobility Districts Using Microscopic Traffic Simulation
",This research effort provides a modeling architecture for AMDs along with a preliminary analysis to quantify the mobility and energy benefits of such districts,National Renewable Energy Laboratory,2018,Energy Efficient Mobility Systems,Conference Paper,http://www.energy.gov/node/4038912
Data Quality Challenges with Missing Values and Mixed Types in Joint Sequence Analysis,"This work builds the methodological framework that will be used for further analysis on WholeTraveler data, once collected.",Lawrence Berkeley National Laboratory,2017,Energy Efficient Mobility Systems,Conference Paper,http://www.energy.gov/node/4038906
Correlations of Platooning Track Test and Wind Tunnel Data,"The National Renewable Energy Laboratory (NREL) analyzed results from several independent truck platooning projects to compare and contrast reported results under similar test conditions to wind tunnel test results conducted by Lawrence Livermore National Laboratory (LLNL). By combining track tests, wind tunnel, and computational fluid dynamics (CFD) results from several organizations, we show where there is broad consensus on results, and highlight areas where additional testing, research, and development is needed.",National Renewable Energy Laboratory,2018,Energy Efficient Mobility Systems,Report,http://www.energy.gov/node/4038903
Connected and Automated Vehicle Concept Dimensions and Examples,"This report defines the dimensions by which CAV systems should be characterized and then describes a set of representative CAV use cases to serve as the basis for SMART Mobility analyses.  Early, middle and late time frames for market adoption of these use cases are defined  to provide a common basis for future SMART Mobility studies.",Lawrence Berkeley National Laboratory,2018,Energy Efficient Mobility Systems,Report,http://www.energy.gov/node/4038897
U.S. DRIVE Fuels Working Group: Engine and Vehicle Modeling Study to Support Life-Cycle Analysis of High-Octane Fuels,"This study explored at several engine compression ratios the potential vehicle energy use, volumetric fuel economy, and tailpipe CO2 emissions effects of different RON levels, octane sensitivity (OS), and volumetric ethanol content in gasoline and non-ethanol bio-derived feedstocks.  The study enables a more complete study of the potential impacts of increasing octane ratings, in coordination with the companion FWG study entitled ""Well-to-Wheels Energy and Greenhouse Gas Emission Analysis of Bio-Blended High-Octane Fuels for High-Efficiency Engines"", which examined upstream energy use to produce, via various pathways, the fuels studied.",U.S. DRIVE Partnership,2019,Advanced Engine and Fuel Technoloies,Report,http://www.energy.gov/node/4038642
U.S. DRIVE Fuels Working Group: Potential Impacts of Increased Ethanol Blend-Level in Gasoline on Distribution and Retail Infrastructure,"The report is the third of a group of three reports looking at potential new and/or higher octane fuels for light-duty vehicles. This report focuses on the impact of the fuels evaluated in the prior two reports on vehicles, retail equipment, and terminals. The report seeks to improve understanding of the relevant parameters and effects adopting a new fuel would have on certain stakeholders, including retail fueling sites and terminals.",U.S. DRIVE Partnership,2019,Advanced Engine and Fuel Technoloies,Report,http://www.energy.gov/node/4038642
U.S. DRIVE Fuels Working Group: Well-to-Wheels Energy and Greenhouse Gas Emission Analysis of Bio-Blended High-Octane Fuels for High-Efficiency Engines,"This report examines the potential benefits of reducing energy use and greenhouse gas (GHG) emissions throughout the well-to-wheels (WTW) cycle by considering both the energy and emissions of production of these higher octane number fuels and their use in engines, with fuel efficiency improvement enabled by high octane number fuels with low-carbon renewable contents. A WTW analysis was undertaken to examine the energy and GHG effects of producing fuels with higher octane numbers and their combustion in advanced engines. The fuels evaluated were formulated with various gasoline blendstock and renewable blending components and tested by USDRIVE and Coordinating Research Council (CRC) members in a turbocharged gasoline direct injection (GDI) engine at several compression ratios (see companion FWG report entitled ""Engine and Vehicle Modeling Study to Support Life-Cycle Analysis of High-Octane Fuels"").",U.S. DRIVE Partnership,2019,Advanced Engine and Fuel Technoloies,Report,http://www.energy.gov/node/4038642
Will Vehicle Automation Accelerate or Decelerate Electrification: Modeling Demand For Automated Electric Vehicles,"A consumer choice model called MA3T-MC is developed by expanding the existing MA3T model that focuses only on fuel type choices. Key findings include: 1) automation may increase sales shares of gasoline conventional vehicles and decrease shares of efficient vehicles including HEVs and PHEVs. 2) automation can increase market shares of BEVs, due to the ""free"" range extension from the efficiency improvement by automation. 3) consumer heterogeneity is important to quantify the national impact of automation on sales shares by fuel types and the total energy use.",Oak Ridge National Laboratory,2018,Energy Efficient Mobility Systems,Journal Article,http://www.energy.gov/node/4010541
Optimal Control of Connected and Automated Vehicles at Roundabouts,This paper investigates the implications of optimally coordinating vehicles that are wirelessly connected to each other and to an infrastructure in roundabouts to achieve a smooth traffic flow without stop-and-go driving. We apply an optimization framework and an analytical solution that allows optimal coordination of vehicles for merging in such traffic scenario. The effectiveness of the proposed approach is validated through simulation and it is shown that coordination of vehicles can reduce total travel time by 3~49% and fuel consumption by 2~27% on a roundabout scenario with respect to different traffic levels,Oak Ridge National Laboratory,2018,Energy Efficient Mobility Systems,Conference Paper,http://www.energy.gov/node/4010532
Control of Networked Traffic Flow Distribution - A Stochastic Distribution System Perspective," We performed a preliminary investigation on the modelling and control framework in context of urban network of signalized intersections. . Further, we proposed a preliminary B-Spline stochastic model for a one-way single-lane corridor traffic system based on theory of stochastic distribution control.. It has been shown that the developed stochastic model would provide the optimal probability density function (PDF) of the traffic queueing length as a dynamic function of the traffic signal setting ",Pacific Northwest National Laboratory,2018,Energy Efficient Mobility Systems,Conference Paper,http://www.energy.gov/node/4010523
Initial assessment and modeling framework development for automated mobility districts,"1) The AMD concept of AVs serving as the basis for a public mobility, on-demand traveler request is relatively new (apart from older ATN studies) and is different and distinct from modeling frameworks for traditional transit modes which are highly reliant on captive ridership. 2) Thus, there are no well-established simulation or widely accepted modeling tools or methodologies for impact analysis. 3) This paper includes an extensive literature review and a foundation for an operational framework for modeling travel in AMDs.  4) A follow-up paper, which contains the final framework and preliminary simulation results is in the works. ",National Renewable Energy Laboratory,2017,Energy Efficient Mobility Systems,Conference Paper,http://www.energy.gov/node/4010520
Trip Energy Estimation Methodology and Model Based on Real-World Driving Data for Green Routing Applications,The paper outlines a real-world data informed methodology for estimating trip energy consumption before a trip is driven. The methodology is intended to be used in green-routing algorithms to optimize trip energy consumption.,National Renewable Energy Laboratory,2018,Energy Efficient Mobility Systems,Conference Paper,http://www.energy.gov/node/4010514
Consumer Behavioral Adaption in EV Fast Charging Through Pricing,"Recently, there have been great advances in Direct current fast chargers (DCFC) technology. Manufacturers of public EV fast charging stations are breaking ground on this technology by offering ultra-fast chargers that are capable of adding tens of miles of range in minutes (EVgo 2017, ChargePoint 2017b). With advanced DCFC technology and proliferation of EVs in the light-duty vehicle market, efficient allocation and operation of DCFC infrastructure and developing successful business models for DCFC deployment are amongst the topics of high interest for research in both academia and industry.",Idaho National Laboratory,2017,Energy Efficient Mobility Systems,Journal Article,http://www.energy.gov/node/4010505
Analysis of Fast Charging Station Network for Electrified Ride-Hailing Services,"Exploring charging needs of TNC (transportation network companies) electric vehicles, we generate pseudo-synthetic trip data of TNC electric automobiles movements through a heuristic algorithm, estimate public charging infrastructure needs via EVI-Pro charging infrastructure planning tool, and evaluate the operational and capital costs for the fast charging station sites suggested through the EVI-Pro analysis.",National Renewable Energy Laboratory,2018,Energy Efficient Mobility Systems,Conference Paper,http://www.energy.gov/node/4010220
Green Routing Fuel Saving Opportunity Assessment: A Case Study Using Large-Scale Real-World Travel Data,"Introduces an evaluation framework for estimating the benefits of green routing based on large-scale, real-world travel data. Analysis of a large-scale, high-resolution data set from the California Household Travel Survey indicates that 31% of actual routes have fuel savings potential, and among these routes the cumulative fuel savings could reach 12%. The potential fuel savings relative to the full set of actual routes (including those that already follow the greenest route recommendation), the potential savings relative to the overall estimated fuel consumption would be 4.5%.",National Renewable Energy Laboratory,2017,Energy Efficient Mobility Systems,Conference Paper,http://www.energy.gov/node/4010217
Airport Analyses Informing New Mobility Shifts: Opportunities to Adapt Energy-Efficient Mobility Services and Infrastructure,"Airports in cities are experiencing a massive increase in passengers and ride-hailing travel demands, while air travel from cities now represents over 9% of total U.S. transportation energy use (EIA, 2016); In 2016, $3.5 billion in parking and ground transportation fees represented 41% of the $8.5 billion in U.S. airport revenue not related to airlines. TNCs now account for 5 to 15% of air travel passengers; with parking demand at airports having he potential to be cut in half in about 14 years if current annual trends were to continue (with parking revenues per passenger peaking approximately 12 to 24 months after introduction of TNCs).",National Renewable Energy Laboratory,2018,Energy Efficient Mobility Systems,Conference Paper,http://www.energy.gov/node/4010214
Potentials for Platooning in U.S. Highway Freight Transport,"This paper explores the potential fuel savings form platooning for the class 8 vehicle population utilizing 194 vehicles in NREL's FleetDNA database. About 65% of the total miles driven by combination trucks from this data sample could be driven in platoon formation, leading to a 4% reduction in total truck fuel consumption.",National Renewable Energy Laboratory,2017,Energy Efficient Mobility Systems,Conference Paper,http://www.energy.gov/node/4010211
A survey on the coordination of connected and automated vehicles at intersections and merging at highway on-ramps,"This paper presents an optimization framework and an analytical, closed-form solution that allows online coordination of vehicles at the merging zone. The proposed solution shows that optimal coordination of vehicles can reduce fuel consumption and travel time significantly",Oak Ridge National Laboratory,2016,Energy Efficient Mobility Systems,Journal Article,http://www.energy.gov/node/4010208
2018 Annual Merit Review Report,"The 2018 U.S. Department of Energy (DOE) Vehicle Technologies Office (VTO) Annual Merit Review Meeting (AMR) was held June 18-21, 2018, in Arlington, VA. The review encompassed all of the work done by VTO: 235 individual activities were reviewed by 247 reviewers. A total of 1,202 individual review responses were received for the VTO technical reviews.
The objective of the meeting was to review the accomplishments and plans for VTO over the previous 12 months, and provide an opportunity for industry, government, and academia to give inputs to DOE on the Office with a structured and formal methodology. The meeting also provided attendees with a forum for interaction and technology information transfer.",Vehicle Technologies Office,2018,Office-wide,Report,http://www.energy.gov/node/3884631
Technology Integration FY2017 Annual Progress Report,"The 2017 Technology Integration Annual Progress Report covers 27 multi-year projects funded by the Vehicle Technologies Office. The report includes information on 20 competitively awarded projects, ranging from training on alternative fuels and vehicles for first responders, to safety training and design for maintenance facilities housing gaseous fuel vehicles, to electric vehicle community partner programs. It also includes seven projects conducted by several of VTO's national laboratory partners, Argonne National Laboratory, Oak Ridge National Laboratory and the National Renewable Energy Laboratory. These projects range from a Technical Assistance project for business, industry, government and individuals, to the EcoCar 3 Student Competition, and the Fuel Economy Information Project.",Vehicle Technologies Office,2018,Technology Integration,Report,http://www.energy.gov/node/3473303
Materials FY2017 Annual Progress Report,"The Materials Technology subprogram supports the Vehicle Technology Office's mission to help consumers and businesses reduce their transportation energy costs while meeting or exceeding vehicle performance expectations. The Propulsion Materials research portfolio seeks to develop higher performance materials that can withstand increasingly extreme environments and address the future properties needs of a variety of high efficiency powertrain types, sizes, fueling concepts, and combustion modes. Advanced Lightweight Materials research enables improvements in fuel economy by providing properties that are equal to or better than traditional materials at a lower weight. Because it takes less energy to accelerate a lighter object, replacing cast iron and traditional steel components with lightweight materials such as high-strength steel, magnesium (Mg), aluminum (Al), and polymer composites can directly reduce a vehicle's fuel consumption. Materials technology activities focus on the following cost and performance targets: (1) enable a 25 percent weight reduction for light-duty vehicles including body, chassis, and interior as compared to a 2012 baseline at no more than a $5/lb-saved increase in cost; and (2) validate a 25 percent improvement in high temperature (300 Degrees Celsius) component strength relative to components made with 2010 baseline cast Al alloys (A319 or A356) for improved efficiency light-duty engines.",Vehicle Technologies Office,2018,Materials,Report,http://www.energy.gov/node/3473291
Energy Efficient Mobility Systems FY2017 Annual Progress Report,"During fiscal year 2017 (FY 2017), the U.S. Department of Energy (DOE) Vehicle Technologies Office (VTO) created the Energy Efficient Mobility Systems (EEMS) Program to understand the range of mobility futures that could result from these disruptive technologies and services, and to create solutions that improve mobility energy productivity, or the value derived from the transportation system per unit of energy consumed. Increases in mobility energy productivity result from improvements in the quality or output of the transportation system, and/or reductions in the energy used for transportation.",Vehicle Technologies Office,2018,Energy Efficient Mobility Systems,Report,http://www.energy.gov/node/3473288
Electrification FY2017 Annual Progress Report,"During fiscal year 2017 (FY 2017), the U.S. Department of Energy (DOE) Vehicle Technologies Office (VTO) funded early stage research & development (R&D) projects that address Batteries and Electrification of the U.S. transportation sector. The VTO Electrification Sub-Program is composed of Electric Drive Technologies, and Grid Integration activities. The Electric Drive Technologies group conducts R&D projects that advance Electric Motors and Power Electronics technologies. The Grid and Charging Infrastructure group conducts R&D projects that advance Grid Modernization and Electric Vehicle Charging technologies. This document presents a brief overview of the Electrification Sub-Program and progress reports for its R&D projects. Each of the progress reports provide a project overview and highlights of the technical results that were accomplished in FY 2017.",Vehicle Technologies Office,2018,Batteries and Electrification,Report,http://www.energy.gov/node/3473276
Batteries FY2017 Annual Progress Report,The Advanced Batteries research and development (R&D) subprogram within the DOE Vehicle Technologies Office (VTO) provides support and guidance for projects focusing on batteries for plug-in electric vehicles.,Vehicle Technologies Office,2018,Batteries and Electrification,Report,http://www.energy.gov/node/3473261
Analysis FY2017 Annual Progress Report,"During fiscal year 2017, the U.S. Department of Energy Vehicle Technologies Office (VTO) funded analysis projects supportive of VTO's goals to pursue early stage research in vehicle and mobility system technologies to reduce petroleum dependence, increase energy reliability and security, improve transportation affordability, and promote economic growth. VTO analysis projects result in a foundation of data, analytical models, and applied analyses that provide insights into critical transportation energy problems and assist in research investment prioritization and portfolio planning.",Vehicle Technologies Office,2018,Analysis,Report,http://www.energy.gov/node/3473258
Advanced Combustion Systems & Fuels FY2017 Annual Progress Report,"The Advanced Combustion Systems and Fuels Program supports VTO's goal and focuses early-stage research and development (R&D) to improve understanding of the combustion processes, fuel properties, and emission control technologies while generating knowledge and insight necessary for industry to develop the next generation of engines.",Vehicle Technologies Office,2018,Advanced Engine and Fuel Technoloies,Report,http://www.energy.gov/node/3473249
"Impacts of Electrification of Light-Duty Vehicles in the United States, 2010 - 2017","This report examines the sales of plug-in electric vehicles (PEVs) in the United States from 2010 to 2017, exploring vehicle sales, electricity consumption, petroleum reduction, and battery production, among other factors. Over 750,000 PEVs have been sold, driving nearly 16 billion miles on electricity, thereby reducing gasoline consumption by 0.1% in 2016 and 600 million gallons cumulatively through 2017, while using over 5 terawatt-hours of electricity. Over 23 gigawatt-hours of battery capacity has been placed in vehicles, and 98% of this is still on the road, assuming typical scrappage rates.",Argonne National Laboratory,2018,Analysis,Report,http://www.energy.gov/node/3434607
Electrification Beyond Light Duty: Class 2b-3 Commercial Vehicles,"The class 2b-3 truck market covers a wide range of commercial truck applications across a half-million vehicle sales annually. This report collected public information and stakeholder input to assess the opportunity for electrification in this market. Although class 2b-3 pickup truck and van bodies are very similar to personal light vehicles, their functional requirements are quite different due to the demands of the commercial market. These demands vary by application and often vary from day to day for a single application. Fleet customers purchase these vehicles to perform a particular job for their business and are concerned about the overall cost of doing that job. Therefore, the vehicles must meet the job requirements cost effectively. Customers also are sensitive to initial cost. Electrification offers the potential to reduce vehicle operating costs and possibly improve vehicle functionality. However, the current market for class 2b-3 electrified trucks is very small, and the trucks are costly. Increased production volumes are key to cost reductions and may be assisted by sharing components with larger or smaller truck classes. Expanding demand is also crucial and stakeholders identified several niche markets with duty cycles that are likely well-suited to electrified class 2b-3 trucks. To expand beyond these niches, class 2b-3 electric solutions must be robust, flexible, and adaptable in order to cover a wide range of vocations, applications, and duty cycles.",Oak Ridge National Laboratory,2018,Analysis,Report,http://www.energy.gov/node/3434604
