Publication Title,Summary,Published By,Publication Year,Technology Area,Publication Type,CMS node
Developing a Platform to Analyze Behavioral Impacts of Connected and Automated Vehicles at the National Level,"This study aims to develop a methodological framework that utilizes multiclass data fusion and data transferability techniques, which uses data and models from a smaller geographical area (e.g., Chicago and Detroit) to generate the needed disaggregate data in a larger scale (e.g., national level). This framework is able to perform a comprehensive examination on the impacts of CAV in transportation networks. To achieve this goal, an advanced transportation systems simulation model, POLARIS, which simulates both travel behavior and traffic flow, is used to estimate the potential impacts of CAV technologies at a regional- level. The rich output of CAV scenario analysis in POLARIS framework includes information on person- level and household-level socio-demographic attributes as well as detailed activity-travel patterns. Transferable variables such as total trip rates and travel times are also derived from POLARIS. Following that, the authors use Exhaustive CHAID decision tree models for each transferable variable to cluster people into several homogeneous groups through which various types of lifestyles are captured. The best-fitted statistical distribution for each of the final decision tree clusters is then determined to analyze the specific behavior of members of each cluster toward transferable variables. Finally, using an artificial neural network model, cluster membership rules and travel statistics are transferred to the national level to develop a validated baseline national platform for analyzing connected automated vehicles scenarios. The platform that is capable of transferring travel behavior to national level with high level of accuracy will be utilized to test various policies and scenarios that may affect the use of CAV and their national impacts.",Argonne National Laboratory,2017,Energy Efficient Mobility Systems,Conference Paper,https://trid.trb.org/view/1439507
Developing A Spatial Transferability Platform to Analyze National-level Impacts of Connected Automated Vehicles,"A recent application of the spatial transferability approach is to assess the potential impacts of the emerging connected automated mobility technology on people's travel behavior at the national level. While there are a few transportation simulation frameworks which can account for potential impacts of this technology in a simulated geographical context, there is yet to be any literature documenting disaggregated estimates of large-scale impacts of connected automated vehicles (CAVs) on travel behavior at the national level. Therefore, in order to provide a platform to assess national-level impacts of CAVs, this study develops a methodological framework based on transferability techniques, which uses data and models from a smaller geographical area-the POLARIS simulation results for the CAVs scenario in the Chicago metropolitan area-to generate disaggregate travel data at the national level. Comparison of the distributions of the transferred variables at the regional and the national contexts indicates that the platform is capable of transferring travel behavior indices to the national level with high level of accuracy.",Argonne National Laboratory,2018,Energy Efficient Mobility Systems,Journal Publication,https://link.springer.com/chapter/10.1007/978-3-319-89806-3_12
Data-driven Multi-step Demand Prediction for Ride-hailing Services Using Convolutional Neureal Network ,"Ride-hailing services are growing rapidly and becoming one of the most disruptive technologies in the transportation realm. Accurate prediction of ride-hailing trip demand not only enables cities to better understand people's activity patterns, but also helps ride-hailing companies and drivers make informed decisions to reduce deadheading vehicle miles traveled, traffic congestion, and energy consumption. In this study, a convolutional neural network (CNN)-based deep learning model is proposed for multi-step ride-hailing demand prediction using the trip request data in Chengdu, China, offered by DiDi Chuxing. The CNN model is capable of accurately predicting the ride-hailing pick-up demand at each 1-km by 1-km zone in the city of Chengdu for every 10 min. Compared with another deep learning model based on long short-term memory, the CNN model is 30% faster for the training and predicting process. The proposed model can also be easily extended to make multi-step predictions, which would benefit the on-demand shared autonomous vehicles applications and fleet operators in terms of supply-demand rebalancing. The prediction error attenuation analysis shows that the accuracy stays acceptable as the model predicts more steps.",Oak Ridge National Laboratory,2019,Energy Efficient Mobility Systems,Journal Publication,https://link.springer.com/chapter/10.1007%2F978-3-030-17798-0_2
Factors Influencing Willingness to Pool in Ride-Hailing Trips,"In this study, newly available Chicago transportation network provider data were explored to identify the extent to which different socioeconomic, spatiotemporal, and trip characteristics affect willingness to pool (WTP) in ride-hailing trips. Multivariate linear regression and machine-learning models were employed to understand and predict WTP based on location, time, and trip factors. The results show intuitive trends, with income level at drop-off and pickup locations and airport trips as the most important predictors of WTP. Results from this study can help TNCs and cities devise strategies that increase pooled ride-hailing, thereby reducing adverse transportation and energy impacts from ride-hailing modes.",National Renewable Energy Laboratory,2020,Energy Efficient Mobility Systems,Journal Publication,https://journals.sagepub.com/doi/full/10.1177/0361198120915886
Analysis of Transit Users' Response Behavior in Case of Unplanned Service Disruptions,"Utilizing recently collected data of transit users in the Chicago Metropolitan Area, the current study aims to analyze how transit users respond to an unplanned service disruption and disclose the factors that affect their behavior. In this study, a random parameter multinomial logit model is employed to consider heterogeneity across observations as well as panel effects. The results of the analysis reveal that a wide range of factors including socio-demographic attributes, personal attitudes, trip-related information, and built environment are significant in passengers' behavior in case of unplanned transit disruptions. Moreover, the effect of service recovery time on passengers is not the same among all types of disrupted services; rail users are more sensitive to the recovery time as compared with bus users. The findings of this study provide insights for transportation authorities to improve the transit service quality in relation to user satisfaction and transportation resilience. These insights help transit agencies to implement effective recovery strategies.",Argonne National Laboratory,2020,Energy Efficient Mobility Systems,Journal Publication,https://journals.sagepub.com/doi/full/10.1177/0361198120911921
Analysis of the Effects of Connected-Automated Vehicle Technologies on Travel Demand,"Connected-automated vehicle (CAV) technologies are likely to have significant effects not only on how vehicles operate in the transportation system, but also on how individuals behave and use their vehicles. While many CAV technologies-such as connected adaptive cruise control and ecosignals-have the potential to increase network throughput and efficiency, many of these same technologies have a secondary effect of reducing driver burden, which can drive changes in travel behavior. Such changes in travel behavior-in effect, lowering the cost of driving-have the potential to increase greatly the utilization of the transportation system with concurrent negative externalities, such as congestion, energy use, and emissions, working against the positive effects on the transportation system resulting from increased capacity. To date, few studies have analyzed the potential effects on CAV technologies from a systems perspective; studies often focus on gains and losses to an individual vehicle, at a single intersection, or along a corridor. However, travel demand and traffic flow constitute a complex, adaptive, nonlinear system. Therefore, in this study, an advanced transportation systems simulation model-POLARIS-was used. POLARIS includes cosimulation of travel behavior and traffic flow to study the potential effects of several CAV technologies at the regional level. Various technology penetration levels and changes in travel time sensitivity have been analyzed to determine a potential range of effects on vehicle miles traveled from various CAV technologies.",Argonne National Laboratory,2017,Energy Efficient Mobility Systems,Journal Publication,https://journals.sagepub.com/doi/10.3141/2625-01
"Children, Income, and the Impact of Home Delivery on Household Shopping Trips","Researchers examine the degree to which home delivery substitutes for or supplements household shopping trips. Impacts across 2 separate shopping trip modal categories are considered: vehicle and nonvehicle. Purchases across 4 product categories (groceries, clothing, household items, and prepared meals) were analyzed. The team drills down on 2 key household characteristics (income and presence of children at home). 4 hypotheses are tested and are largely motivated by the roles time saving and convenience play in delivery use, and the resulting impact on shopping travel, based on income and child status. ",Lawrence Berkeley National Laboratory,2020,Energy Efficient Mobility Systems,Journal Publication,https://journals.sagepub.com/doi/10.1177/0361198120935113
Potential Energy Implications of Connected and Automated Vehicles: Exploring Key Leverage Points through Scenario Screening and Analysis,"The authors have developed a system dynamics model for generating, analyzing, and screening self-consistent CAV adoption scenarios. Results can support selection of scenarios for subsequent computationally intensive study using higher-resolution models. The potential for and barriers to large-scale adoption of CAVs have been analyzed using preliminary quantitative data and qualitative understandings of system relationships among stakeholders across the breadth of these issues. Although they are based on preliminary data, the results map possibilities for achieving different levels of CAV adoption and system-wide fuel use and demonstrate the interplay of behavioral parameters such as how consumers value their time versus financial parameters such as operating cost. By identifying the range of possibilities, estimating the associated energy and transportation service outcomes, and facilitating screening of scenarios for more detailed analysis, this work could inform transportation planners, researchers, and regulators.",National Renewable Energy Laboratory,2019,Energy Efficient Mobility Systems,Journal Publication,https://journals.sagepub.com/doi/10.1177/0361198119838840
"Clustering Life Course to Understand the Heterogeneous Effects of Life Events, Gender, and Generation on Habitual Travel Modes","Daily transportation mode choice is largely habitual, but transitions between life events may disrupt travel habits and can shift choices between alternative transportation modes. Although much is known about general mode switches following life event transitions, less is understood about differences that may exist between subpopulations, especially from a long-term perspective. Understanding these differences will help planners and policymakers introduce more targeted policy interventions to promote sustainable transportation modes and inform longer-term predictions. Extending beyond existing literature, we use data collected from a retrospective survey to investigate the effects of life course events on mode use situated within different long-term life trajectory contexts. We apply a machine-learning method called joint social sequence clustering to define five distinct and interpretable cohorts based on trajectory patterns in family and career domains over their life courses. We use these patterns as an innovative contextual system to investigate (1) the heterogeneous effects of life events on travel mode use and (2) further differentiation between gender and generation groups in these life event effects. We find that events occurring relatively early in life are more strongly associated with changes in mode-use behavior, and that mode use can also be affected by the relative order of events. This timing and order effect can have lasting impacts on mode use aggregated over entire life cycles: members of our ""Have-it-alls"" cohort-who finish their education, start working, partner up, and have children early in life-ramp up car use at each event, resulting in the highest rate of car use occurring the earliest among all the cohorts. Women drive more when having children primarily when their family formation and career formation are intertwined early in life, and younger generations rely relatively more on car use during familial events when their careers have a later start.",Lawrence Berkeley National Laboratory,2020,Energy Efficient Mobility Systems,Journal Publication,https://ieeexplore.ieee.org/document/9229427
Exploring the Mobility and Energy Implications of Shared Versus Private Autonomous Vehicles,"The prevailing trend toward greater automation and connectivity requires modeling and analysis tools to explore connectivity, automation, decision science and other future mobility issues at multiple scales. This paper describes various modeling efforts in order to model the mobility and energy impact of autonomous and connected technologies; design of scenarios under different technological, behavioral, and socioeconomic assumptions; and finally, key findings from the scenario runs enabled by the advanced models developed. The integrated ABM-DTA software POLARIS has been extended to include transit, intra-household vehicle sharing, transportation network company (TNC) operations along with updates to the mesoscopic traffic models and value of time adjustments due to new technologies affecting the mode, destination, and route choice. The three scenarios are summarized as high sharing - low automation, high sharing - high automation, and low sharing - high automation, with VMT changes ranging from -13% to 42%.",Argonne National Laboratory,2019,Energy Efficient Mobility Systems,Conference Paper,https://ieeexplore.ieee.org/document/8917125
"Optimum Planning for Inductively Charged On-demand Automated Electric Shuttles at Greenville, South Carolina","Wireless charging technology presents perfect fits for autonomous electric vehicles for realizing a fully automated system (vehicle and charger). This paper presents a planning optimization analysis for a pilot project of in-route wireless charging infrastructure serving fixed-route on-demand shared automated electric shuttles (SAESs) at Greenville, South Carolina, USA. A single-objective non-linear integer planning optimization problem is formulated. A comprehensive cost function representing the inductively charged SAESs is developed, considering road construction, power electronics and materials, traction battery, and installation costs. The optimization problem is solved to determine the best combination of the system key design parameters (number and allocations of wireless chargers, charging power level, track length and on-board battery capacity) that show the most cost-effective solution and allow the SAESs realizing charge sustaining operation. The planning platform incorporates representative simulated traffic data (drive cycles and routes) for four SAESs at Greenville project using the Simulation of Urban Mobility (SUMO) tool. These data are fed to a vehicle powertrain model and a wireless charger power model to predict the battery power, energy and state-of-charge (SOC) profiles, which are provided to the search algorithm to assess the design objectives under specific constraints. The results indicated that implementing wireless charging at a few designated stops for fixed-route SAESs with proper design allows the vehicles realizing charge sustaining operation, infinite range and zero recharge downtime, with a significant reduction in the on-board battery (36 % ) and road coverage (69%), at minimum cost.",National Renewable Energy Laboratory,2019,Energy Efficient Mobility Systems,Conference Paper,https://ieeexplore.ieee.org/document/8912343
Joint Fleet Sizing and Charging System Planning for Autonomous Electric Vehicles,"This paper studies the joint fleet sizing and charging system planning problem for a company operating a fleet of autonomous electric vehicles (AEVs) for passenger and goods transportation. Most of the relevant published papers focus on intracity scenarios and adopt heuristic approaches, e.g., agent based simulation, which do not guarantee optimality. In contrast, we propose a mixed integer linear programming model for intercity scenarios. This model incorporates comprehensive considerations of 1) limited AEV driving range; 2) optimal AEV routing and relocating operations; 3) time-varying origin-destination transport demands; and 4) differentiated operation cost structure of passenger and goods transportation. The proposed model can be computational expensive when the scale of the transportation network is large. We then exploit the structure of this program to expedite its solution. Numerical experiments are conducted to validate the proposed method. Our experimental results show that AEVs in passenger and goods transportation have remarkable planning and operation differences. We also demonstrate that intelligent routing and relocating operations, charging system and vehicle parameters, e.g., charging power, battery capacity, driving speed etc., can significantly affect the economic efficiency and the planning results of an AEV fleet.",Lawrence Berkeley National Laboratory,2019,Energy Efficient Mobility Systems,Journal Publication,https://ieeexplore.ieee.org/document/8880643
An Automated Vehicle Fuel Economy Benefits Evaluation Framework Using Real-World Travel and Traffic Data,"Increasing automation is a consistent development trend in the automobile industry. However, real-world evaluation of the operational and energy consumption differences between automated vehicles and comparable manually driven vehicles has been limited. This study helps fill the information gap by comparing the operation and fuel economy of vehicles in adaptive cruise control (ACC) and non-ACC modes based on large-scale field test data collected by Volvo Car Corporation (Volvo Cars) from vehicles traveling on the designated ""Drive Me"" project road network in Gothenburg, Sweden. The test vehicles' travel data are classified by driving mode (ACC vs. non-ACC) and driving conditions, which refer to traffic speed and road grade in this study. The results from the data logging fleet are used to estimate the aggregate fuel consumption differences at the Drive Me road-network level for vehicles traveling in ACC vs. non-ACC mode based on appropriately weighting the total amount of travel that took place on the network under different driving conditions. At the ACC penetration levels observed in the field test data, vehicles tended to drive more smoothly in ACC mode than in non-ACC mode. The corresponding travel-weighted fuel consumption rate for vehicles in ACC mode was about 5%-7% lower than for vehicles in non-ACC mode when traveling at similar conditions. Sensitivity analyses impart confidence in this result, and in the future, the established evaluation framework could be used to objectively quantify potential on-road fuel consumption impacts from vehicles with even higher levels of automated driving capability.",National Renewable Energy Laboratory,2019,Energy Efficient Mobility Systems,Journal Publication,https://ieeexplore.ieee.org/document/8744229
Minimizing Energy Consumption from Connected Signalized Intersections by Reinforcement Learning,"Explicit energy minimization objectives are often discouraged in signal optimization algorithms due to its negative impact on mobility performance. One potential direction to solve this problem is to provide a balanced objective function to achieve desired mobility with minimized energy consumption. This research developed a reinforcement learning (RL) based control with reward functions considering energy and mobility in a joint manner-a penalty function is introduced for number of stops. Further, we proposed a clustering-based technique to make the state-space finite which is critical for a tractable implementation of the RL algorithm. We implemented the algorithm in a calibrated NG-SIM network within a traffic micro-simulator-PTV VISSIM. With sole focus on energy, we report 47% reduction in energy consumption when compared with existing signal control schemes, however causing a 65.6% increase in system travel time. In contrast, the control strategy focusing on energy minimization with penalty for stops yields 6.7% reduction in energy consumption with 27% increase in system travel time. The developed RL algorithm with a flexible penalty function in the reward will achieve desired energy goals for a network of signalized intersections without compromising on the mobility performance. Disclaimer: This manuscript has been authored by UT-Battelle, LLC under Contract No. DE-AC05-00OR22725 with the U.S. Department of Energy. The United States Government retains and the publisher, by accepting the article for publication, acknowledges that the United States Government retains a non-exclusive, paid-up, irrevocable, world-wide license to publish or reproduce the published form of this manuscript, or allow others to do so, for United States Government purposes. The Department of Energy will provide public access to these results of federally sponsored research in accordance with the DOE Public Access Plan (http://energy.gov/downloads/doe-public-access-plan.",Oak Ridge National Laboratory,2018,Energy Efficient Mobility Systems,Conference Paper,https://ieeexplore.ieee.org/document/8569891
Simulation of Heavy-Duty Vehicles in Platooning Scenarios,"Connectivity and automation provide the potential to use information about the environment and future driving to minimize energy consumption. In order to achieve this goal, the designers of control strategies need to simulate a wide range of driving situations that can interact with other vehicles and the infrastructure to account for the specific powertrain characteristics of each automated vehicle. We present here a simulation framework called RoadRunner, which aims to facilitate the design of powertrain-aware eco-driving algorithms and a better understanding of the interactions between automation and powertrain technology. RoadRunner allows users to simulate both powertrain and longitudinal dynamics within a simulated environment. The user defines the scenario to be simulated by providing a route profile, intersection control types, number of vehicles, vehicle class, powertrain technology, connectivity, and automation level. RoadRunner then builds a Simulink diagram of the scenario, including the information flows between vehicles, and between vehicles and the road. After the simulation, the user can analyze the driving, component operations, and detailed energy consumption rates for each simulated vehicle. We present a case study on heavy-duty vehicles platooning. Using RoadRunner and detailed road data from digital maps, we quantify the impact of gap setting on fuel consumption, for a real-world route.",Argonne National Laboratory,2018,Energy Efficient Mobility Systems,Conference Paper,https://ieeexplore.ieee.org/document/8569275
Automated and Cooperative Vehicle Merging at Highway On-Ramps,"Recognition of necessities of connected and automated vehicles (CAVs) is gaining momentum. CAVs can improve both transportation network efficiency and safety through control algorithms that can harmonically use all existing information to coordinate the vehicles. This paper addresses the problem of optimally coordinating CAVs at merging roadways to achieve smooth traffic flow without stop-and-go driving. We present an optimization framework and an analytical closed-form solution that allows online coordination of vehicles at merging zones. The effectiveness of the efficiency of the proposed solution is validated through a simulation, and it is shown that coordination of vehicles can significantly reduce both fuel consumption and travel time.",Oak Ridge National Laboratory,2016,Energy Efficient Mobility Systems,Journal Publication,https://ieeexplore.ieee.org/document/7534837
